section,in_resume,title,institution,loc,start,end,description_1,description_2,description_3
education,TRUE,"M.S. Program Evaluation and Data Analytics",Arizona State University,"Tempe, AZ",2023., NA, NA
education,TRUE,"B.S., psychology (minor C.S.)",Illinois State University,"Normal, IL",2016,2017., NA, NA
research_positions,FALSE,Research Assistant,Psychology Laboratory,Illinois State University,2012,2013,Independently analyzed and constructed statistical models for large data sets pertaining to carbon decomposition rates.,NA,NA
industry_positions,FALSE,Software Engineering Intern,Conduce,"Carpinteria, CA",2014,2014,Incorporated d3.js to the company's main software platform.,NA,NA
industry_positions,FALSE,Engineering Intern - User Experience,Dealer.com,"Burlington, VT",2015,2015,Built internal tool to help analyze and visualize user interaction with back-end products.,NA,NA
industry_positions,FALSE,Data Science Intern,Dealer.com,"Burlington, VT",2015,2015,Worked with the product analytics team to help parse and visualize large stores of data to drive business decisions.,NA,NA
industry_positions,FALSE,Data Artist In Residence,Conduce,"Carpinteria, CA",2014,2015,"Envisioned, prototyped and implemented visualization framework in the course of one month.",Constructed training protocol for bringing third parties up to speed with new protocol.,NA
industry_positions,TRUE,Data Journalist - Graphics Department,New York Times,"New York, New York",2016,2016,"Reporter with the graphics desk covering topics in science, politics, and sport.","Work primarily done in R, Javascript, and Adobe Illustrator.",NA
